_unit_id,_created_at,_updated_at,_golden,abstract,abstract_size,authors,document_type,eid,in_out_radio_gold,in_out_radio_gold_reason,link,source,source_title,tech_base,tech_include,title,year,false,false_reason
2188833037,3/5/2019 10:18:02,3/5/2019 10:18:02,TRUE,"In this paper we describe the design and validation of a virtual fitness environment aiming at keeping older adults physically and socially active. We target particularly older adults who are socially more isolated, physically less active, and with less chances of training in a gym. The virtual fitness environment, namely Gymcentral, was designed to enable and motivate older adults to follow personalised exercises from home, with a (heterogeneous) group of remote friends and under the remote supervision of a Coach. We take the training activity as an opportunity to create social interactions, by complementing training features with social instruments. Finally, we report on the feasibility and effectiveness of the virtual environment, as well as its effects on the usage and social interactions, from an intervention study in Trento, Italy. © 2016 IEEE.",short,"Báez M., Ibarra F., Far I.K., Ferron M., Casati F.",Conference Paper,2-s2.0-85016938083,yes,The paper describes a study involving a virtual fitness environment that includes the positibility of engaging in social interactions online (with a remote group of friends),https://www.scopus.com/inward/record.uri?eid=2-s2.0-85016938083&doi=10.1109%2fCTS.2016.96&partnerID=40&md5=9bd2ebcc011071204d061ca2361ebfdb,Scopus,"Proceedings - 2016 International Conference on Collaboration Technologies and Systems, CTS 2016",1-gold,1,Online group-exercises for older adults of different physical abilities,2016,,
2188833038,3/5/2019 10:18:02,3/5/2019 10:18:02,TRUE,"Older adults are facing various challenges while using technology. With an ageing society, it is desirable to develop senior-friendly innovations to empower older adults to lead enjoyable and fulfilling lives. This study examines ageing issues of older adults in Singapore and their coping strategies through adoption and appropriation of technology in the form of smartphones and wearable devices. Data was collected through in-depth interviews (10 participants) and focus groups (26 participants in 4 groups). Health problems, financial difficulties, loneliness and security concerns were the major ageing –related issues emerged from our analysis. The current status of technology use, adoption barriers and desired functions are discussed. © Springer International Publishing Switzerland 2016.",short,"Pang N., Zhang X., Law P.W., Foo S.",Conference Paper,2-s2.0-84978196649,no,The paper discusses adoption of technology by older adults. The technology discussed is general (smartphones and wearable devices) and the paper does not focus on its use for online social interaction. ,https://www.scopus.com/inward/record.uri?eid=2-s2.0-84978196649&doi=10.1007%2f978-3-319-39949-2_35&partnerID=40&md5=95d5fcf0f9f5af2d4a22f8ef6aedc9eb,Scopus,Lecture Notes in Computer Science (including subseries Lecture Notes in Artificial Intelligence and Lecture Notes in Bioinformatics),0-gold,0,Coping with ageing issues: Adoption and appropriation of technology by older adults in Singapore,2016,,
2188833039,3/5/2019 10:18:02,3/5/2019 10:18:02,TRUE,"Social Networking Sites have become useful tools to strengthen communication with family and friends. Older adults, however, are often hesitant to use SNSs and are reluctant adopters of modern communication media. This results in an asymmetric condition, where younger and older adults use different media and communication channels. To balance communication practices we integrated classic media based on pen and paper with online social networks. In this paper we present a 36 weeks deployment study with an extended family (n=12) of the use of Tlatosketch, a hybrid system based on a digital photo frame, and digital pen and paper technology. This combination allows older adults to stay updated on Facebook and to post paper notes to Facebook. Our results show that Tlatosketch provides the older adult with a new media for self-expression, and improves the family social experience, thus helping them remain active while ageing. We close discussing directions for future work. © 2015 ICST.",short,"Cornejo R., Weibel N., Tentori M., Favela J.",Conference Paper,2-s2.0-84963750852,yes,The paper describes a study involving a digital photo frame that allows older adults to stay connected to their family via Facebook,https://www.scopus.com/inward/record.uri?eid=2-s2.0-84963750852&doi=10.4108%2ficst.pervasivehealth.2015.259069&partnerID=40&md5=4fd2e9083d68a5673fc7bdad733d732e,Scopus,"Proceedings of the 2015 9th International Conference on Pervasive Computing Technologies for Healthcare, PervasiveHealth 2015",1-gold,1,Promoting active aging with a paper-based SNS application,2015,,
2188833040,3/5/2019 10:18:02,3/5/2019 10:18:02,TRUE,"Natural interfaces are facilitating the adoption of videogames by older adults, promoting the development of serious games aimed at encouraging healthy behaviors in this population. In this paper we present the design and evaluation of an ambient game, GuessMyCaption, aimed at enhancing the social networks of older adults, known to have an impact in their wellbeing. GuessMyCaption was deployed during a 5-weeks study in the home of one older adult and twelve relatives. The results demonstrate that GuessMyCaption is easy to use and maintains an older adult engaged with exercises while offering new opportunities for online and offline socialization. GuessMyCaption had a positive impact in the perceived wellbeing of the older adult improving her perception on her cognitive skills and physical health, and catalyzing socialization. This research shows that the use of natural interfaces and family memorabilia facilitate the adoption of serious games, improves older adults' perceived wellbeing, and encourage socialization. © 2015 IEEE.",short,"Cornejo R., Hernández D., Tentori M., Favela J.",Article,2-s2.0-84938365144,yes,"The paper describes a sudy involving a tool, namely GuessMyCaption, that offers opportunities for online social interactions",https://www.scopus.com/inward/record.uri?eid=2-s2.0-84938365144&doi=10.1109%2fTLA.2015.7164221&partnerID=40&md5=467d3cb8dc8a056ec7caed5858b0df93,Scopus,IEEE Latin America Transactions,1-gold,1,Casual gaming to encourage active ageing,2015,,
2188833041,3/5/2019 10:18:02,3/5/2019 10:18:02,TRUE,"In this paper we examine the use of a novel social technology to support the provision of formal aged care services to clients who live in their own homes. Social technologies offer enormous potential for enhancing aged care, but research on their use in aged care has largely focused on institutional or informal care settings, rather than formal care in the home. Meanwhile, technologies for aging in place typically focus on monitoring and security, rather than psychosocial support. We conducted a field study in which aged care managers used a photo and message-sharing tool to communicate with clients living in their own homes. Our findings demonstrate that visual and social forms of communication are valuable for supporting psychosocial care-giving, but there are barriers to effectively adopting new communication tools in this setting. Time constraints inhibited care managers' use of the technology, which was also influenced by their efforts to carefully maintain boundaries between their personal and professional lives.",short,"Waycott J., Davis H., Vetere F., Morgans A., Gruner A., Ozanne E., Kulik L.",Conference Paper,2-s2.0-84900406069,yes,The paper describes a study involving a photo and message sharing tool enable (online) communication between age care managers and their clients,https://www.scopus.com/inward/record.uri?eid=2-s2.0-84900406069&doi=10.1145%2f2556288.2557290&partnerID=40&md5=96595daf277b247a5677a6762eda585c,Scopus,Conference on Human Factors in Computing Systems - Proceedings,1-gold,1,Captioned photographs in psychosocial aged care: Relationship building and boundary work,2014,,
2188833043,3/5/2019 10:18:02,3/5/2019 10:18:02,TRUE,"This study explored the health care service needs and the major correlates of quality of life among 127 community-dwelling elderly Chinese immigrants in a western Canadian city. Participants were interviewed in their homes by trained, bilingual interviewers employing a structured questionnaire that covered a wide range of topics including health care service needs, living arrangements, health status, social network, life satisfaction, and socio-demographic information. Results demonstrated that ethnic nursing homes, senior centres that provide programs and services, and homemaker services were respondents' major service needs. Multiple ordinary least-squares regression analysis revealed that respondents who emigrated from Mainland China and those who exhibited greater psychological well-being, reported being physically more mobile, perceived fewer service needs, and expressed satisfaction with the quality of their neighbourhood demonstrated higher levels of life satisfaction. © 2011 Springer Science+Business Media B.V.",short,Chow H.P.H.,Article,2-s2.0-84857790382,no,The paper does not discuss either technology or online social interactions,https://www.scopus.com/inward/record.uri?eid=2-s2.0-84857790382&doi=10.1007%2fs11205-011-9810-0&partnerID=40&md5=433b339af28b612ef5085a8f0481f09c,Scopus,Social Indicators Research,0-gold,0,Health Care Service Needs and Correlates of Quality of Life: A Case Study of Elderly Chinese Immigrants in Canada,2012,,
2188833044,3/5/2019 10:18:02,3/5/2019 10:18:02,TRUE,"Effects of compensatory strategies offered by Wii technology on physical activity, loneliness, and mood are investigated. Thirty-five individuals (M = 82 years) were randomly assigned to either playing Wii or watching television with a partner for 10 weeks. Physical activity, loneliness, mood, life satisfaction, and health were assessed. The elderly playing Wii had lower loneliness and a pattern of greater positive mood compared to the television group. No differences in life satisfaction or physical activity were found, but loneliness predicted positive mood, and positive mood predicted physical activity. This investigation points to the benefits of using Wii for well-being, particularly social connection and enjoyment. © 2011 Copyright Taylor and Francis Group, LLC.",short,"Kahlbaugh P.E., Sperandio A.J., Carlson A.L., Hauselt J.",Article,2-s2.0-84858112037,no,"The paper discusses a study that involve watching tv or playing Wii with a partner, but face to face. Therefore, the study did not focus on online social interactions",https://www.scopus.com/inward/record.uri?eid=2-s2.0-84858112037&doi=10.1080%2f01924788.2011.625218&partnerID=40&md5=5d2c7c4f2ecbf02764a15b7eea467186,Scopus,"Activities, Adaptation and Aging",0-gold,0,"Effects of Playing Wii on Well-Being in the Elderly: Physical Activity, Loneliness, and Mood",2011,,
2188833045,3/5/2019 10:18:02,3/5/2019 10:18:02,TRUE,"Situated learning theory understands learning to be a sociocultural activity, and individuals experience identity development as they participate in communities of practice. The purpose of this study was to understand how Korean older adults' computer learning in a classroom is a situated activity and how this learning influences older adults' identities. Eleven sessions of an intermediate course for older adults were observed, and 10 older computer learners were interviewed. This study revealed that social interactions, learning tools, the physical setting, and Korean culture were embedded in the course and shaped the learning processes. This study also found that the participants' learning in the community of practice in the classroom as well as the larger community of general computer users influenced their identity. © 2010 American Association for Adult and Continuing Education.",short,"Kim Y.S., Merriam S.B.",Article,2-s2.0-78049293811,no,"The paper describes a study focused on computer learning in a classroom. Therefore, the social interactions described in the paper happened in the context of the classroom, face to face.",https://www.scopus.com/inward/record.uri?eid=2-s2.0-78049293811&doi=10.1177%2f0741713610363019&partnerID=40&md5=6465a2a99c817d875a601620e32daef9,Scopus,Adult Education Quarterly,0-gold,0,Situated learning and identity development in a korean older adults' computer classroom,2010,,
2188833046,3/5/2019 10:18:02,3/5/2019 10:18:02,TRUE,"Semistructured interviews with an educated sample explored normative aging processes and computer ownership regarding change in communication patterns over a decade among older adults as they progressed through events of the life course. Findings indicated that many of the changes concerned normative aging processes: living arrangements, physical limitations, retirement, and aging of communication partners. Changes in communication mediums aided by technology and how technology affected medium of preference for use, frequency, and quantity of communication also were found. Participant responses indicated computer ownership and Internet access increased the total social network, frequency of communication, quality of relationships, and helped reinstate distant/past friendships. © Taylor & Francis Group, LLC.",short,"Beckenhauer J.I.L., Armstrong J.",Article,2-s2.0-77649194163,yes,"The paper describes a study investigating computer ownership and communication patterns, addressing communication via digital mediums",https://www.scopus.com/inward/record.uri?eid=2-s2.0-77649194163&doi=10.1080%2f01494920903224418&partnerID=40&md5=89ec1119cd2f800c5f942ec7e7d70a7a,Scopus,Marriage and Family Review,1-gold,1,"Exploring relationships between normative aging, technology, and communication",2009,,
2188833047,3/5/2019 10:18:02,3/5/2019 10:18:02,TRUE,"This paper discusses some general results from an in-situ study of the use of a tabletop system for card playing that differs in several ways from most tabletop systems: 1. It was designed primarily for use by senior citizens with little or no computer experience. 2. It is a single-user system, though social interaction with nearby persons during its use is typical. 3. It includes a simple conversational agent (representing the game's other player). 4. It is used in a setting (a senior citizens' center) in which the users also play cards in the traditional ways. A total of 42 regular visitors of the center participated over a 4-week period. From our observations and results, we draw several conclusions that should apply to other tabletop systems that share one or more of the characteristics just listed. © 2008 IEEE.",short,"Gabrielli S., Bellutti S., Jameson A., Leonardi C., Zancanaro M.",Conference Paper,2-s2.0-57749209143,no,"The paper describes a study involving a tabletop game designed for individual use, or with people nearby (face to face). Online social interactions were not supported / studied in this paper",https://www.scopus.com/inward/record.uri?eid=2-s2.0-57749209143&doi=10.1109%2fTABLETOP.2008.4660188&partnerID=40&md5=f0eebe84a20fb4fa6cc8ea9d93ee3c18,Scopus,"2008 IEEE International Workshop on Horizontal Interactive Human Computer System, TABLETOP 2008",0-gold,0,A single-user tabletop card game system for older persons: General lessons learned from an in-situ study,2008,,
2188833048,3/5/2019 10:18:02,3/5/2019 10:18:02,TRUE,"This study examines plans for future caregiving made by family members of younger (n = 59) and older adults (n = 16) with serious mental illness (SMI). An online survey was advertised through a newsletter of the National Alliance on Mental Illness. Qualitative analyses yielded four areas of caregiver concern: health of the care recipient over time, ability of caregivers to sustain support, social support available for the care recipient, and financial burden of care. Despite these concerns, few caregivers reported completed plans for future caregiving. One fourth of the caregivers had made no plans, nor had they discussed future caregiving with others. Although most would prefer other relatives to assume care in the event they could not sustain support, these expectations may not be communicated openly. Generating discussion on this pertinent topic has implications for the aging society regarding how best to care for those with SMI and their caregivers. © 2008 The Southern Gerontological Society.",short,"Corsentino E.A., Molinari V., Gum A.M., Roscoe L.A., Mills W.L.",Article,2-s2.0-48249088014,no,The paper does not discuss either technology or online social interactions,https://www.scopus.com/inward/record.uri?eid=2-s2.0-48249088014&doi=10.1177%2f0733464808315290&partnerID=40&md5=4811f732e0f1b71c4338dfa52df816ac,Scopus,Journal of Applied Gerontology,0-gold,0,Family caregivers' future planning for younger and older adults with serious mental illness (SMI),2008,,
2188833049,3/5/2019 10:18:02,3/5/2019 10:18:02,TRUE,"Aim. To study effects of hostility on the risk of arterial hypertension (AH), myocardial infarction (MI) and stroke in males aged 25-64 years. Materials and methods. A screening study of the population was performed in 1994 according to WHO program MONICA-psychosocial. The response in a random representative sample of 25-64-year-old males (n = 657) living in Novosibirsk was 82.1%. New cases of MI, AH and stroke were registered in the control periods 1994-2000, 1994-2002. Computer program package SPSS-10 was used for statistic processing. Cox regression model of the relative risk (RR) was employed. Results. Hostility was rather prevalent among the examinees (76.9%). MI risk for 8 years was 4.65 times higher in hostile men. Hostility was not associated with higher risk of AH and stroke. Hostility was seen more frequently in men with poor education, workers and retired persons. These groups are also at the highest risk of MI. Conclusion. Hostility raises MI risk in unstable society but had no effect on the risk of AH and stroke.",short,"Gafarov V.V., Gromova E.A., Gagulin I.V., Gafarova A.V.",Article,2-s2.0-33750438406,no,The paper does not discuss either technology or online social interactions,https://www.scopus.com/inward/record.uri?eid=2-s2.0-33750438406&partnerID=40&md5=d24dd040d84c8ec68db686b1928f2dfe,Scopus,Terapevticheskii Arkhiv,0-gold,0,"Effects of hostility on the risk of arterial hypertension, myocardial infarction, stroke in a sample of males aged 25-64 years (epidemiological trial on the base of WHO program MONICA)",2006,,
2188833050,3/5/2019 10:18:02,3/5/2019 10:18:02,TRUE,"In light of projected labor shortages in key industries and underfunded retirement plans, this study investigated the reasons some older employees choose to continue working past their retirement-eligibility dates. Using a sample of 15 workers ages 52 to 67 and a qualitative interview methodology, the authors determined that retention of employer-provided health care benefits may be a critical factor in encouraging older workers to remain on the job. Further, workers in this sample highly valued the opportunity for positive social interaction on their jobs and indicated that more flexible work schedules would be one change the employer could make that would have the most immediate impact on their decision to retire. They also said that more money, more recognition/appreciation, more autonomy, and more opportunities to develop skills and knowledge would potentially keep them on the job longer. The authors conclude with a discussion of implications for practice and research. © 2004, Taylor & Francis Group, LLC. All rights reserved.",short,"Schimmel K., Nicholls J.",Article,2-s2.0-85008862742,no,The paper does not discuss either technology or online social interactions. Social interactions are mentioned but referring to the work environment,https://www.scopus.com/inward/record.uri?eid=2-s2.0-85008862742&doi=10.1300%2fJ238v01n01_05&partnerID=40&md5=900e6e41f5a475de354b5e40945483ab,Scopus,Journal of Website Promotion,0-gold,0,Media mix elements that motivate online shopping,2005,,
2188833051,3/5/2019 10:18:02,3/5/2019 10:18:02,TRUE,"Elderly people in Japan are becoming part of virtual communities. This article explores the online experience of such people, how they interact with others and how they construct social support relationships via computer-mediated communication (CMC). This ethnographic research, through participant observation and in-depth interviews, reveals that these elderly people enjoy interaction in a variety of language forms, ranging from haiku to emoticons, by combining traditional text-based Japanese culture with a new virtual culture, despite the limitations of text-based communication. Also, both the immediacy and asynchrony of CMC helps them to construct real human relationships in the virtual community, including social connectedness to others as well as supportive and companionship relationships. The elderly people could create a sense of greater propinquity by sharing their old stories and memories.",short,Kanayama T.,Article,2-s2.0-0037839038,yes,This paper investigate computer mediated communications (and therefore online social interactions) in Japanese older adults,https://www.scopus.com/inward/record.uri?eid=2-s2.0-0037839038&doi=10.1177%2f1461444803005002007&partnerID=40&md5=8fa5dac71ba2d1a9e2686b98953f7255,Scopus,New Media and Society,1-gold,1,Ethnographic research on the experience of Japanese elderly people online,2003,,
2188833052,3/5/2019 10:18:02,3/5/2019 10:18:02,TRUE,"A slow-stream rehabilitation program for frail elderly patients was developed utilising nursing homes visited by a mobile rehabilitation team (MRT) based at the hospital from which these patients had been discharged following major illness. The nursing homes were able to provide physiotherapy and the MRT contributed medical, nursing, occupational therapy and social work support through weekly visits. The supported group and a control group (also discharged to nursing homes from the same hospital but unsupported) were matched for age, sex and ADL level. Outcomes for the two groups were compared and were significantly different. Of the supported group (N = 33), 64% (N = 21) were discharged home compared with only 9% (N = 2) of the 23 control subjects (χ2 = 15.6, df. = 1, P &lt; 0.05). The potential for patient rehabilitation in a modestly supported nursing home was realised. © 1995.",short,"Salgado R., Ehrlich F., Banks C., Browne E., Buckman S., Burraston B.",Article,2-s2.0-0029059151,no,The paper does not discuss either technology or online social interactions,https://www.scopus.com/inward/record.uri?eid=2-s2.0-0029059151&doi=10.1016%2f0167-4943%2895%2900621-Q&partnerID=40&md5=c1c2a94bca6a112ea1db6368f45386ec,Scopus,Archives of Gerontology and Geriatrics,0-gold,0,A mobile rehabilitation team program to assist patients in nursing homes rehabilitate and return to their homes,1995,,
2188833053,3/5/2019 10:18:02,3/5/2019 10:18:02,TRUE,"Stroke often results in one or more serious long-term effects. Older persons who experience stroke typically experience other chronic conditions as well. This article analyzes coping strategies of home-based older people who experienced a stroke, focusing on use of assistive devices. In a sample of 35 older people with stroke, 20% had either moved into a nursing home or had died within 1 year of an initial interview. The remaining 27 older people were interviewed twice, at 1-year intervals. Comparisons were made to determine changes over 1 year for measures of health, functional status, and psychosocial status, as well as ownership, usage, and satisfaction with assistive devices. Three case studies are presented to illustrate how these older people use assistive technology in coping with the effects of stroke and their other chronic conditions. © 1995 Aspen Publishers, Inc.",short,"Mann W.W., Hurren D., Tomita M., Charvat B.A.",Article,2-s2.0-0029113856,no,The paper does not discuss either technology or online social interactions,https://www.scopus.com/inward/record.uri?eid=2-s2.0-0029113856&doi=10.1097%2f00013614-199509000-00010&partnerID=40&md5=b2962940225a472cd402a9efeb89742f,Scopus,Topics in Geriatric Rehabilitation,0-gold,0,A follow–up study of older stroke survivors living at home,1995,,
2188833054,3/5/2019 10:18:02,3/5/2019 10:18:02,,"Elderly care is of increasing global concern. The aging population is expected to increase two-fold by 2050. It is anticipated that there will not be enough caregivers to assist the elderly very soon, and thus, researchers are looking at various technologies and potential applications that will help alleviate the problem of elderly care. This chapter examines one such assistive technology: conversational agents in the form of avatars or robots as an aid to decrease loneliness and depression among the elderly and increase the cognitive function and quality of life. The authors discuss the state-of-the-science of research prototypes and commercial off-the-shelf systems. They propose a novel concept and design, and the authors discuss the ethical ramifications of senior citizens possibly bonding with inanimate objects as if they were human companions. © 2017, IGI Global.",short,Lewis L.,Book Chapter,2-s2.0-85021381114,,,https://www.scopus.com/inward/record.uri?eid=2-s2.0-85021381114&doi=10.4018%2f978-1-5225-2237-9.ch034&partnerID=40&md5=78b0a599b206aa2f2db0c4e1ad4db77e,Scopus,"Healthcare Ethics and Training: Concepts, Methodologies, Tools, and Applications",0-U,0,Using narrative with avatars and robots to enhance elder care,2017,,
